{
  "openapt": "1.0",
  "repositories": {
  },
  "mirrors": {
    "debian_stretch": {
      "archive": "http://deb.debian.org/debian",
      "distribution": "stretch",
      "filter": "toilet"
    },
    "debian_buster": {
      "archive": "http://deb.debian.org/debian",
      "distribution": "buster",
      "filter": "toilet"
    }
  },
  "snapshots": {
    "debian_stretch": {
      "type": "create",
      "mirror": "debian_stretch"
    },
    "debian_buster": {
      "type": "create",
      "mirror": "debian_buster"
    }
  },
  "publishings": {
  }
}
